{
  "$schema": "../../config/schema/bot-config.schema.json",
  "dataDir": "../../data",
  "accounts": {
    "main": {
      "enabled": true,
      "adapter": "onebot11",
      "accountId": "REPLACE_WITH_BOT_QQ",
      "oneBot": {
        "eventWebSocketUri": "ws://127.0.0.1:3001/",
        "httpBaseUri": "http://127.0.0.1:3000/",
        "accessTokenEnv": "IIBOT_NAPCAT_ACCESS_TOKEN",
        "privateTempGroupId": "",
        "suppressSelfMessages": true,
        "requestTimeoutSeconds": 10,
        "maxTextLength": 2000
      }
    }
  },
  "control": {
    "host": "127.0.0.1",
    "port": 8765,
    "path": "/mcp/bot",
    "bearerTokenEnv": "IIBOT_CONTROL_TOKEN"
  },
  "inbox": {
    "dataDir": "../../data/inbox",
    "inboxId": "iibot-bot",
    "bindingLabel": "dsh-bot",
    "channels": ["qq"],
    "bindingTtlHours": 24,
    "apiHost": "127.0.0.1",
    "apiPort": 0,
    "mcpHost": "127.0.0.1",
    "mcpPort": 0,
    "mcpPath": "/mcp",
    "heartbeatMillis": 15000,
    "claimSweepIntervalMillis": 5000
  },
  "messageBoard": {
    "summaryDebounceMillis": 2000,
    "maxPreviewMessages": 20,
    "outbox": {
      "sendTimeoutSeconds": 15,
      "minSendIntervalMillis": 150
    },
    "weighting": {
      "defaultPrivateSourceWeight": 300,
      "defaultGroupSourceWeight": 0,
      "defaultNotifyThreshold": 100,
      "signalWeights": {
        "DM": 200,
        "MENTION": 200,
        "REPLY_TO_BOT": 180,
        "NAME": 120,
        "COMMAND": 250
      },
      "keywordWeights": {},
      "aliases": [],
      "commandPrefixes": ["/", "!"],
      "quietMillis": 180000,
      "cooldownMillis": 60000
    }
  },
  "logging": {
    "directory": "../../logs",
    "console": true,
    "file": true,
    "rootLevel": "INFO",
    "opsLevel": "INFO",
    "levels": {
      "io.mosire.iibot.connect": "INFO",
      "io.mosire.iibot.bot": "INFO",
      "io.mosire.iibot.app": "INFO"
    },
    "maxFileSize": "20MB",
    "maxHistory": 30
  }
}
